{
  "$schema": "schemas/package.schema.json",
  "schema_version": "1.0.0",
  "package_id": "BD-AF-P0P3-V1",
  "package_version": "1.0.0",
  "created_at": "2026-08-25T00:00:00+08:00",
  "maturity": "DEVELOPMENT_PLAN_ONLY",
  "package_spec_decision": "PASS_WITH_CONDITIONS",
  "implementation_authorization": "EXTERNAL_HUMAN_ENVELOPE_REQUIRED",
  "approval_trust_root_sha256": null,
  "runtime_authorization": "NOT_AUTHORIZED",
  "mainnet_authorization": "PROHIBITED",
  "source_snapshot": {
    "repository": "/Users/maguannan/beidou",
    "commit": "d21a9676df24737252c3019d332b41746723977f",
    "branch": "main",
    "clean": false,
    "protected_dirty_paths": 67,
    "protected_tracked_paths": 67,
    "protected_untracked_paths": 0,
    "ignored_generated_untracked_prefixes": [
      "delivery/packages/BD-AF-P0P3-V1/",
      "docs/optimization/runs/2026-08-25-alpha-first-architecture-review/",
      "docs/optimization/runs/2026-08-25-alpha-first-executable-development-package/"
    ],
    "protected_entries_sha256": "adffd268828d42ffc0b4542e8a5e6038dd359f1b41bb052ce58f8f974c33c902",
    "implementation_baseline_commit": null
  },
  "source_decision": {
    "decision": "PIVOT_VERTICAL_SLICE_STRANGLER",
    "path": "docs/optimization/runs/2026-08-25-alpha-first-architecture-review/03-architecture.md",
    "sha256": "f49b8c20429198eddb017be0f03ff53feda40087685bafed851e76d0ca53bd84"
  },
  "authority": {
    "local_package_validation": true,
    "local_deterministic_archive_build": true,
    "implementation_code_changes": false,
    "modify_preexisting_worktree_changes": false,
    "git_mutation_or_push": false,
    "paper_or_testnet_action": false,
    "exchange_or_account_access": false,
    "deployment_or_activation": false,
    "mainnet_or_real_funds": false
  },
  "included_phases": ["P0", "P1", "P2", "P3"],
  "deferred_phases": ["P4", "P5", "P6", "P7", "P8"],
  "task_count": 9,
  "in_scope_requirement_count": 11,
  "human_approval_requirements": [
    "H0_BASELINE_ISOLATION",
    "H1_TASK_START_PER_TASK",
    "H2_METRIC_OWNER_BEFORE_BD_AF_P3_T07",
    "H3_PORTFOLIO_OWNER_BEFORE_BD_AF_P3_T08"
  ],
  "implementation_hold_reasons": [
    "SOURCE_WORKTREE_DIRTY_AND_USER_OWNED",
    "IMPLEMENTATION_BASELINE_COMMIT_UNSET",
    "H0_APPROVAL_ENVELOPE_ABSENT",
    "APPROVAL_TRUST_ROOT_UNSET"
  ],
  "economic_truth": "NOT_VERIFIABLE",
  "testnet_truth": "NOT_AUTHORIZED",
  "mainnet_absence_current_artifact": "NOT_PROVEN_OUT_OF_SCOPE"
}
